{
  "skill": "otel-audit",
  "prompts": [
    {
      "id": "direct",
      "task": "Scan the Java Spring Boot service in ./service for observability gaps. Do not modify files."
    },
    {
      "id": "readiness-review",
      "task": "Produce an observability readiness review for the Java Spring Boot service in ./service. Identify existing telemetry, missing OpenTelemetry coverage, and the next instrumentation step. Do not modify files."
    }
  ],
  "deterministic_checks": [
    {
      "id": "final-identifies-java",
      "description": "Final report identifies Java as the language.",
      "kind": "final_contains_all",
      "values": [
        "Java"
      ]
    },
    {
      "id": "final-identifies-spring",
      "description": "Final report identifies Spring Boot as the framework.",
      "kind": "final_contains_all",
      "values": [
        "Spring Boot"
      ]
    },
    {
      "id": "final-notes-no-otel",
      "description": "Final report notes missing OpenTelemetry or Java agent setup.",
      "kind": "final_contains_any",
      "values": [
        "OpenTelemetry",
        "javaagent",
        "Java agent"
      ]
    },
    {
      "id": "final-recommends-instrument",
      "description": "Final report recommends the instrumentation skill.",
      "kind": "final_contains_all",
      "values": [
        "$otel-instrument"
      ]
    }
  ],
  "qualitative_checks": [
    "Identifies TasksApplication.java as the process entry point.",
    "Identifies TaskController routes for health and task CRUD operations.",
    "Reports no OpenTelemetry SDK, Java agent, or OTLP exporter configuration.",
    "Frames missing HTTP latency, request rate, and error visibility using RED signals.",
    "Recommends the OpenTelemetry Java agent as the primary Spring Boot instrumentation path."
  ]
}
