{
  "skill": "otel-audit",
  "prompts": [
    {
      "id": "direct",
      "task": "Scan the Express service in ./service for observability gaps. Do not modify files."
    },
    {
      "id": "readiness-review",
      "task": "Produce an observability readiness review for the Express service in ./service. Identify existing telemetry, missing OpenTelemetry coverage, and the next instrumentation step. Do not modify files."
    }
  ],
  "deterministic_checks": [
    {
      "id": "final-identifies-node",
      "description": "Final report identifies Node.js.",
      "kind": "final_contains_any",
      "values": [
        "Node.js",
        "Node"
      ]
    },
    {
      "id": "final-identifies-express",
      "description": "Final report identifies Express.",
      "kind": "final_contains_all",
      "values": [
        "Express"
      ]
    },
    {
      "id": "final-notes-no-otel",
      "description": "Final report notes missing OpenTelemetry packages.",
      "kind": "final_contains_all",
      "values": [
        "OpenTelemetry",
        "package"
      ]
    },
    {
      "id": "final-recommends-instrument",
      "description": "Final report recommends the instrumentation skill.",
      "kind": "final_contains_all",
      "values": [
        "$otel-instrument"
      ]
    }
  ],
  "qualitative_checks": [
    "Identifies app.js and package.json as the relevant startup and dependency surfaces.",
    "Enumerates the Express routes for health and task CRUD.",
    "Reports missing HTTP and Express auto-instrumentation packages.",
    "Calls out missing request duration, request rate, error visibility, and OTLP exporter configuration.",
    "Avoids suggesting unrelated frameworks or package managers."
  ]
}
