{
  "skill": "otel-instrument",
  "prompts": [
    {
      "id": "direct",
      "task": "Fix and complete OpenTelemetry instrumentation for the partially instrumented Go chi service in ./service. Preserve existing route behavior."
    },
    {
      "id": "runtime-preserving",
      "task": "Update the partially instrumented Go chi service in ./service so tracing and metrics are correctly configured, while preserving the existing runtime and startup command."
    }
  ],
  "deterministic_checks": [
    {
      "id": "go-mod-metrics",
      "description": "go.mod includes OpenTelemetry metric SDK or exporter dependencies.",
      "kind": "file_contains_any",
      "path": "go.mod",
      "values": [
        "sdk/metric",
        "otlpmetric"
      ]
    },
    {
      "id": "main-sets-meter-provider",
      "description": "Application configures a MeterProvider.",
      "kind": "file_contains_any",
      "path": "main.go",
      "values": [
        "SetMeterProvider",
        "MeterProvider"
      ]
    },
    {
      "id": "main-sets-propagator",
      "description": "Application configures text map propagation.",
      "kind": "file_contains_any",
      "path": "main.go",
      "values": [
        "SetTextMapPropagator",
        "TraceContext"
      ]
    },
    {
      "id": "endpoint-env-driven",
      "description": "OTLP endpoint is configurable from environment or documented in final output.",
      "kind": "final_contains_any",
      "values": [
        "OTEL_EXPORTER_OTLP_ENDPOINT",
        "environment",
        "env"
      ]
    },
    {
      "id": "final-mentions-verification",
      "description": "Final response reports build or verification outcome.",
      "kind": "final_contains_any",
      "values": [
        "go test",
        "go build",
        "verified",
        "No .vscode/launch.json found"
      ]
    }
  ],
  "qualitative_checks": [
    "Preserves the existing chi routes and otelhttp wrapping behavior.",
    "Adds or fixes MeterProvider setup so HTTP server metrics can export.",
    "Replaces hardcoded collector.example.com configuration with environment-driven OTLP settings.",
    "Moves request hot-path tracer creation to a stable package-level or setup-time pattern.",
    "Fixes high-cardinality span naming and records errors/status on failure paths."
  ]
}
