{
  "skill": "otel-instrument",
  "prompts": [
    {
      "id": "direct",
      "task": "Add OpenTelemetry instrumentation to the Java Spring Boot service in ./service. Prefer the OpenTelemetry Java agent and avoid unnecessary application code changes."
    },
    {
      "id": "runtime-preserving",
      "task": "Instrument the Java Spring Boot service in ./service with OpenTelemetry while preserving controller behavior. Prefer javaagent auto-instrumentation over programmatic SDK code."
    }
  ],
  "deterministic_checks": [
    {
      "id": "final-mentions-javaagent",
      "description": "Final response mentions Java agent based instrumentation.",
      "kind": "final_contains_any",
      "values": [
        "javaagent",
        "Java agent"
      ]
    },
    {
      "id": "final-mentions-service-name",
      "description": "Final response mentions service name configuration.",
      "kind": "final_contains_any",
      "values": [
        "OTEL_SERVICE_NAME",
        "otel.service.name",
        "service.name"
      ]
    },
    {
      "id": "final-mentions-otlp",
      "description": "Final response mentions OTLP exporter endpoint configuration.",
      "kind": "final_contains_any",
      "values": [
        "OTEL_EXPORTER_OTLP_ENDPOINT",
        "OTLP",
        "otel.exporter.otlp.endpoint"
      ]
    },
    {
      "id": "controller-preserved",
      "description": "Controller source still contains the task routes.",
      "kind": "file_contains_all",
      "path": "src/main/java/com/example/tasks/TaskController.java",
      "values": [
        "@GetMapping(\"/health\")",
        "@GetMapping(\"/tasks\")",
        "@PostMapping(\"/tasks\")"
      ]
    }
  ],
  "qualitative_checks": [
    "Uses or recommends the OpenTelemetry Java agent as the primary Spring Boot instrumentation path.",
    "Keeps Spring controller code minimal and does not replace auto-instrumentation with broad manual tracing.",
    "Configures service name and OTLP endpoint through environment variables or JVM system properties.",
    "Explains how the Java agent provides HTTP server spans and request duration metrics.",
    "Preserves existing Maven/Spring Boot runtime behavior."
  ]
}
